{
 "evaluated_utc": "2026-10-13T18:50:24Z",
 "run_utc": "2026-10-13T18:38:19Z",
 "rules": [
  "score dropped by 10 or more",
  "score fell under 40",
  "score improved by 10 or more",
  "delay removed: timelock score fell to 0",
  "a queued change against this contract executes within 48 h",
  "a queued change against this contract is ready to execute now",
  "a queued change against this contract was approved and has not been executed for more than 7 days, and is still executable today",
  "the live admin of this contract changed since the previous run (independent read)",
  "the independent reader disagrees with the admin-key score, with money behind it",
  "score pushed more than 7 days ago (the oracle marks it stale at 9)",
  "the score is under public dispute (data/disputes.json), review pending",
  "an upgrade was executed: the implementation behind this contract changed since the previous run",
  "an admin transfer is in flight: a new owner or admin is designated and has not accepted yet (pendingOwner / pendingAdmin)",
  "the contract's own balance fell by 30% to 70% since the previous run (totalAssets(), token units, $1M or more gone)",
  "the contract's own balance fell by 70% or more since the previous run (totalAssets(), token units, $1M or more gone)",
  "the contract reported its own balance (totalAssets()) in a previous run and no longer does",
  "the contract has been paused since the previous run (paused() or isPaused() now true)",
  "the contract is no longer paused (paused() or isPaused() now false)",
  "a secondary role of the contract (curator, guardian, pauser) changed hands, was set or was cleared, or a change of guardian or of delay is announced",
  "the contract's own delay is announced to get shorter (pendingTimelock() lower than timelock()): less time to react to the owner",
  "the Safe that governs this contract, observed idle for 14 days or more, executed a transaction (nonce moved), with money behind it"
 ],
 "active": [
  {
   "rule": "a queued change against this contract executes within 48 h",
   "severity": "medium",
   "chain": "Arbitrum",
   "target": "0x52aa899454998be5b000ad077a46bbe360f4e497",
   "title": "Fluid Lending",
   "score": 59,
   "delta": 0,
   "tvl_usd": 135788760.19046205,
   "first_seen": "2026-10-13T00:57:18Z",
   "new": false,
   "evidence": [
    {
     "timelock": "arbitrum timelock 0x4d6c\u20262346, found by the independent reader (1 tracked contract)",
     "timelock_address": "0x4d6ce4f4498d59eed397bcbc687805a07f9b2346",
     "family": "oz",
     "id": "0x314f235e0b39bc8c5d078368747597d9957804ff085eca875e24b44773ae195b",
     "chain": "arbitrum",
     "tx": "0xa0f93ad721d5d2201e107b9f32a65855b7b2eca61af1b4a60a730bbf922bba74",
     "selector": "0x02c6bb6a",
     "signature": "updateUserSupplyConfigs((address,address,uint8,uint256,uint256,uint256)[])",
     "ready_at": 1791918381,
     "state": "waiting"
    }
   ],
   "previous_run": "2026-10-13T12:40:55Z",
   "notified": true
  },
  {
   "rule": "the contract's own balance fell by 30% to 70% since the previous run (totalAssets(), token units, $1M or more gone)",
   "severity": "medium",
   "chain": "Base",
   "target": "0xbeef2d50b428675a1921bc6bbf4bfb9d8cf1461a",
   "title": "0xbeef\u2026461a",
   "score": 73,
   "delta": 0,
   "tvl_usd": 23465345.902212992,
   "first_seen": "2026-10-13T18:50:24Z",
   "new": true,
   "evidence": [],
   "previous_run": "2026-10-13T12:40:55Z",
   "balance": {
    "symbol": "USDC",
    "from": 43469256.153912,
    "to": 23470525.058664,
    "change_pct": -46.01,
    "since": "2026-10-13T12:46:45Z"
   },
   "notified": true
  },
  {
   "rule": "the independent reader disagrees with the admin-key score, with money behind it",
   "severity": "medium",
   "chain": "Ethereum L1",
   "target": "0x55555815a5595991c3a0ff119b59aef6c8b55555",
   "title": "0x5555\u20265555",
   "score": 2,
   "delta": 0,
   "tvl_usd": 536683806.5651353,
   "first_seen": "2026-10-10T21:14:27Z",
   "new": false,
   "evidence": [],
   "previous_run": "2026-10-13T12:40:55Z",
   "notified": true
  },
  {
   "rule": "the independent reader disagrees with the admin-key score, with money behind it",
   "severity": "medium",
   "chain": "Hyperliquid",
   "target": "0x71f0019cc7fa79e4f42587fb7b9a817d8d2429ec",
   "title": "Kinetiq kmHYPE",
   "score": 4,
   "delta": 0,
   "tvl_usd": 42135645.43286079,
   "first_seen": "2026-10-10T21:14:27Z",
   "new": false,
   "evidence": [],
   "previous_run": "2026-10-13T12:40:55Z",
   "notified": true
  },
  {
   "rule": "the independent reader disagrees with the admin-key score, with money behind it",
   "severity": "medium",
   "chain": "Hyperliquid",
   "target": "0x393d0b87ed38fc779fd9611144ae649ba6082109",
   "title": "Kinetiq kHYPE",
   "score": 4,
   "delta": 0,
   "tvl_usd": 871332603.028874,
   "first_seen": "2026-10-13T18:50:24Z",
   "new": true,
   "evidence": [],
   "previous_run": "2026-10-13T12:40:55Z",
   "notified": true
  },
  {
   "rule": "a queued change against this contract executes within 48 h",
   "severity": "medium",
   "chain": "Plasma",
   "target": "0x52aa899454998be5b000ad077a46bbe360f4e497",
   "title": "Fluid Lending",
   "score": 59,
   "delta": 0,
   "tvl_usd": 36227354.11241204,
   "first_seen": "2026-10-13T00:57:18Z",
   "new": false,
   "evidence": [
    {
     "timelock": "plasma timelock 0x4d6c\u20262346, found by the independent reader (1 tracked contract)",
     "timelock_address": "0x4d6ce4f4498d59eed397bcbc687805a07f9b2346",
     "family": "oz",
     "id": "0xa98044b61f745afa65a2367fd8bc5fe554eea4c107a59c12d0d7858e712871a0",
     "chain": "plasma",
     "tx": "0x7ff3062d6022e01abf9d9bdaf824ca720bbe9ed0d76e25c0fcaed6957e2e061f",
     "selector": "0x01b88f86",
     "signature": "updateUserBorrowConfigs((address,address,uint8,uint256,uint256,uint256,uint256)[])",
     "ready_at": 1791918539,
     "state": "waiting"
    }
   ],
   "previous_run": "2026-10-13T12:40:55Z",
   "notified": true
  },
  {
   "rule": "the independent reader disagrees with the admin-key score, with money behind it",
   "severity": "medium",
   "chain": "Plasma",
   "target": "0x6695c0f8706c5ace3bdf8995073179cca47926dc",
   "title": "Yuzu Money",
   "score": 43,
   "delta": 0,
   "tvl_usd": 65783680.83420794,
   "first_seen": "2026-10-10T21:14:27Z",
   "new": false,
   "evidence": [],
   "previous_run": "2026-10-13T12:40:55Z",
   "notified": true
  },
  {
   "rule": "the independent reader disagrees with the admin-key score, with money behind it",
   "severity": "medium",
   "chain": "Robinhood Chain",
   "target": "0x14b107cf534239c59571b066cb6497a321da897c",
   "title": "Arcus Perps",
   "score": 31,
   "delta": 0,
   "tvl_usd": 55821391.653098196,
   "first_seen": "2026-10-10T21:14:27Z",
   "new": false,
   "evidence": [],
   "previous_run": "2026-10-13T12:40:55Z",
   "notified": true
  },
  {
   "rule": "an admin transfer is in flight: a new owner or admin is designated and has not accepted yet (pendingOwner / pendingAdmin)",
   "severity": "medium",
   "chain": "Robinhood Chain",
   "target": "0xfe7e25de55e5cbbecccb661f3679f873f72b9b0d",
   "title": "0xfe7e\u20269b0d",
   "score": 1,
   "delta": 0,
   "tvl_usd": null,
   "first_seen": "2026-10-10T21:14:27Z",
   "new": false,
   "evidence": [],
   "previous_run": "2026-10-13T12:40:55Z",
   "notified": true
  },
  {
   "rule": "the independent reader disagrees with the admin-key score, with money behind it",
   "severity": "medium",
   "chain": "Solana",
   "target": "GKnHiWh3RRrE1zsNzWxRkomymHc374TvJPSTv2wPeYdB",
   "title": "Kamino Liquidity",
   "score": 54,
   "delta": 0,
   "tvl_usd": 72515550.38472709,
   "first_seen": "2026-10-10T21:14:27Z",
   "new": false,
   "evidence": [],
   "previous_run": "2026-10-13T12:40:55Z",
   "notified": true
  },
  {
   "rule": "a queued change against this contract was approved and has not been executed for more than 7 days, and is still executable today",
   "severity": "medium",
   "chain": "Solana",
   "target": "H4ND9aYttUVLFmNypZqLjZ52FYiGvdEB45GmwNoKEjTj",
   "title": "Jupiter Perpetual Exchange",
   "score": 46,
   "delta": 0,
   "tvl_usd": 757505501.5196742,
   "first_seen": "2026-10-12T08:47:32Z",
   "new": false,
   "evidence": [
    {
     "timelock": "Squads v4 multisig AxkJ\u2026UUSm (4-of-8, time lock 86400 s), found by the independent reader (1 tracked program)",
     "timelock_address": "AxkJ8oH5aDu4ZRWfsujPtxdb6Vhq4gDehpoReBgrUUSm",
     "family": "squads",
     "id": "squads:AxkJ8oH5aDu4ZRWfsujPtxdb6Vhq4gDehpoReBgrUUSm:20",
     "chain": "solana",
     "tx": null,
     "selector": null,
     "signature": "Squads proposal #20: Upgrade of program PERPHjGBqRHArX4DySjwM6UJHiR3sWAatqfdBS2qQJu",
     "ready_at": 1786184864,
     "state": "ready"
    }
   ],
   "previous_run": "2026-10-13T12:40:55Z",
   "notified": true
  },
  {
   "rule": "the independent reader disagrees with the admin-key score, with money behind it",
   "severity": "medium",
   "chain": "Solana",
   "target": "H4ND9aYttUVLFmNypZqLjZ52FYiGvdEB45GmwNoKEjTj",
   "title": "Jupiter Perpetual Exchange",
   "score": 46,
   "delta": 0,
   "tvl_usd": 757505501.5196742,
   "first_seen": "2026-10-10T21:14:27Z",
   "new": false,
   "evidence": [],
   "previous_run": "2026-10-13T12:40:55Z",
   "notified": true
  },
  {
   "rule": "a queued change against this contract executes within 48 h",
   "severity": "medium",
   "chain": "Solana",
   "target": "2LecshUwdy9xi7meFgHtFJQNSKk4KdTrcpvaB56dP2NQ",
   "title": "Orca DEX",
   "score": 2,
   "delta": 0,
   "tvl_usd": 302558677.39199764,
   "first_seen": "2026-10-13T18:50:24Z",
   "new": true,
   "evidence": [
    {
     "timelock": "Squads v4 multisig BQsD\u2026iEjF (5-of-13, time lock 86400 s), found by the independent reader (1 tracked program)",
     "timelock_address": "BQsDWkL417U4tVE2sDnPks469pKdm6YzFgKH77doiEjF",
     "family": "squads",
     "id": "squads:BQsDWkL417U4tVE2sDnPks469pKdm6YzFgKH77doiEjF:98",
     "chain": "solana",
     "tx": null,